{
  "page_width": 595.276,
  "page_height": 841.89,
  "body_top": 160.0,
  "left_bottom": 775.0,
  "right_bottom": 765.0,
  "row_tol": 1.5,
  "match_tol": 2.0,
  "budget_labels": {
    "当初予算額": "当初予算額",
    "補正予算額": "補正予算額",
    "継続費及び繰越事業費繰越額": "継続費及び繰越事業費繰越額",
    "予備費支出": "予備費支出及び流用増減",
    "予備費支出及び流用増減": "予備費支出及び流用増減"
  },
  "level_amounts": [
    "計",
    "当初予算額",
    "補正予算額",
    "継続費及び繰越事業費繰越額",
    "予備費支出及び流用増減",
    "支出済額",
    "翌年度繰越額",
    "不用額"
  ],
  "setsu_amounts": [
    "金額",
    "支出済額",
    "翌年度繰越額",
    "不用額"
  ],
  "uchiwake_exclusion": {
    "kind": "経費内訳",
    "reason": "右頁備考の経費内訳ブロックは事業別の分解で節対応未確認のため行化せず、属する目の目_備考へ保持する。"
  },
  "position_suffixes": [
    "物理頁",
    "左端",
    "上端",
    "右端",
    "下端"
  ]
}
